id,description,en
advancedSearch.accordion.hide,Label for hide button when accordion is closed,Hide
advancedSearch.accordion.show,Label for show button when accordion is closed,Show
advancedSearch.form.childDetails,The title of Child details accordion,Child details
advancedSearch.form.dateOfRegistration,Label for input date of registration,Date of registration
advancedSearch.form.deceasedDetails,The title of Deceased details accordion,Deceased details
advancedSearch.form.eventDetails,The title of event details accordion,Event details
advancedSearch.form.fatherDetails,The title of Father details accordion,Father details
advancedSearch.form.informantDetails,The title informant details form,Notifier details
advancedSearch.form.motherDetails,The title of Mother details accordion,Mother details
advancedSearch.form.placeOfRegistration,Label for input Place of registration,Place of registration
advancedSearch.form.placeOfRegistrationHelperText,Helper text for input Place of registration,"Search for a province, district or registration office"
advancedSearch.form.recordStatusAchived,Option for form field: status of record,Archived
advancedSearch.form.recordStatusAny,Option for form field: status of record,Any status
advancedSearch.form.recordStatusCertified,Option for form field: status of record,Certified
advancedSearch.form.recordStatusCorrectionRequested,Option for form field: status of record,Correction requested
advancedSearch.form.recordStatusInReview,Option for form field: status of record,In review
advancedSearch.form.recordStatusInprogress,Option for form field: status of record,In progress
advancedSearch.form.recordStatusRegistered,Option for form field: status of record,Registered
advancedSearch.form.recordStatusRequireUpdate,Option for form field: status of record,Requires updates
advancedSearch.form.registrationDetails,The title of Registration details accordion,Registration details
advancedSearch.form.statusOfRecordLabel,Label for input Status of record,Status of record
advancedSearchResult.pill.childDoB,The label for child d.o.b in active advancedSearchParams,Child d.o.b
advancedSearchResult.pill.childFirstName,The label for child firstname in active advancedSearchParams,Child firstname
advancedSearchResult.pill.childLastName,The label for child lastname in active advancedSearchParams,Child lastname
advancedSearchResult.pill.deceasedDoB,The label for deceased d.o.b in active advancedSearchParams,Deceased d.o.b
advancedSearchResult.pill.deceasedFirstName,The label for deceased firstname in active advancedSearchParams,Deceased firstname
advancedSearchResult.pill.deceasedLastName,The label for deceased lastname in active advancedSearchParams,Deceased lastname
advancedSearchResult.pill.event,The label for event param in active advancedSearchParams,Event
advancedSearchResult.pill.eventDate,The label for event date param in active advancedSearchParams,Event date
advancedSearchResult.pill.eventLocation,The label for event location in active advancedSearchParams,Event location
advancedSearchResult.pill.fatherDoB,The label for father d.o.b in active advancedSearchParams,Father d.o.b
advancedSearchResult.pill.fatherFirstName,The label for father firstname in active advancedSearchParams,Father firstname
advancedSearchResult.pill.fatherLastName,The label for father lastname in active advancedSearchParams,Father lastname
advancedSearchResult.pill.gender,The label for gender in active advancedSearchParams,Sex
advancedSearchResult.pill.informantDoB,The label for informant d.o.b in active advancedSearchParams,Notifier d.o.b
advancedSearchResult.pill.informantFirstName,The label for informant firstname in active advancedSearchParams,Notifier firstname
advancedSearchResult.pill.informantLastName,The label for informant lastname in active advancedSearchParams,Notifier lastname
advancedSearchResult.pill.motherDoB,The label for mother d.o.b in active advancedSearchParams,Mother d.o.b
advancedSearchResult.pill.motherFirstName,The label for mother firstname in active advancedSearchParams,Mother firstname
advancedSearchResult.pill.motherLastName,The label for mother lastname in active advancedSearchParams,Mother lastname
advancedSearchResult.pill.regDate,The label for  registration date in active advancedSearchParams,Registration date
advancedSearchResult.pill.regLocation,The label for event location in active advancedSearchParams,Location
advancedSearchResult.pill.regNumber,The label for registration number in active advancedSearchParams,Registration number
advancedSearchResult.pill.registationStatus,The label for registration Status param in active advancedSearchParams,Registration status
advancedSearchResult.pill.trackingId,The label for tracking id in active advancedSearchParams,Tracking ID
advancedSearchResult.table.noResult,The label for no result in advancedSearchResult page,No result
advancedSearchResult.table.searchResult,The label for search result header in advancedSearchResult page,Search results
buttons.add,Add button text on form config,Add
buttons.apply,Apply button label,Apply
buttons.approve,Approve button text,Approve
buttons.archive,Archive button text,Archive
buttons.assign,Assign button label,Assign
buttons.back,Back button,Back
buttons.cancel,Cancel button text in the modal,Cancel
buttons.change,Change action,Change
buttons.changeLanguage,,Change language
buttons.closeDeclaration,Close declaration button text,Close declaration
buttons.configure,Configure button text,Configure
buttons.confirm,Label used for confirm button,Confirm
buttons.continue,Continue Button Text,Continue
buttons.copied,Copied button text,Copied
buttons.copy,Copy button text,Copy
buttons.create,Label for submit button of client integration creation form,Create
buttons.delete,Delete button,Delete
buttons.deleteDeclaration,Delete declaration button text,Delete declaration
buttons.drafts,,Drafts
buttons.edit,Edit button text,Edit
buttons.editRecord,Correct record button text on review certificate,"No, make correction"
buttons.editRegistration,Edit registration button text,Edit registration
buttons.exactDateUnknown,Label for DateRangePickerForFormField components daterangepicker toggle button,Exact date unknown
buttons.exit,Label for Exit button on EventTopBar,Exit
buttons.finish,The label for finish printing certificate button,Finish
buttons.forgotPassword,The label for forgot password button,Forgot password
buttons.forgottenPIN,The label for forgotten pin button,Forgotten pin
buttons.goToHomePage,Label for Go to Homepage button,Back to home
buttons.homepage,,Homepage
buttons.issue,Button for issuing,Issue
buttons.login,Login button on session expire modal,Login
buttons.logout,logout title,Logout
buttons.makeCorrection,Make correction button text on correction summary,Make correction
buttons.menu,,Menu
buttons.next,The label for next button,Next
buttons.no,No button text,No
buttons.preview,Preview button,Preview
buttons.print,Print button text,Print
buttons.printCertificate,,Print certificate
buttons.printDeclaration,,Print declaration
buttons.publish,Publish button text on form config,Publish
buttons.refresh,Refresh button,Refresh
buttons.register,Label for button on register confirmation modal,Register
buttons.reinstate,Label for reinstate button,Reinstate
buttons.reject,A label for reject link,Send for updates
buttons.rejectDeclaration,Reject declaration button text,Reject declaration
buttons.replace,Label for replacing the whole section in review form,Change all
buttons.retry,The title of retry button for failed declaration,Retry
buttons.review,Review button text,Review
buttons.save,Save Button Text,Save
buttons.saveAndExit,Save & exit Button Text,Save & Exit
buttons.saveDraft,,Save as draft
buttons.saving,Saving Button Text,Saving...
buttons.search,The title of search input submit button,Search
buttons.select,The select title,Select
buttons.send,Submit button on submit modal,Confirm
buttons.sendForApproval,Title for complete submit button,Send for approval
buttons.sendForReview,Submit Button Text,Send for review
buttons.sendForUpdates,,Send for updates
buttons.sendIncomplete,Title for Incomplete submit button,Send for review
buttons.settings,Menu item settings,Settings
buttons.start,Label of start button,Start
buttons.status,Label of status button,Status
buttons.unassign,Unassign button label,Unassign
buttons.update,The title of update button for draft declaration,Update
buttons.upload,Upload buttton,Upload
buttons.verify,Label for verify password button,Verify
buttons.view,Label for link button view,View
buttons.yes,Yes button text,Yes
certificate.confirmCorrect,Edit,Please confirm that the notifier has reviewed that the information on the certificate is correct and that you are ready to print.
certificate.isCertificateCorrect,Question asking the user if the information on the  certificate is correct,Is the {event} certificate correct?
certificate.label.birth,,Birth
certificate.label.death,,Death
certificate.label.dob,,D.o.B
certificate.label.dod,,D.o.D
certificate.parent.details.label.age,Person age,Age
certificate.parent.details.label.dateOfBirth,Parent Date of Birth,Date of Birth
certificate.parent.details.label.familyName,Parent last name,Last name
certificate.parent.details.label.familyNameInEng,Parent last name,Last name
certificate.parent.details.label.firstName,Parent first names,First name(s)
certificate.parent.details.label.firstNameInEng,Parent first names,First name(s)
certificate.parent.details.label.nationality,Parent Nationality,Nationality
certificate.parent.details.label.number,Parent number,Number
certificate.parent.details.label.typeOfID,Parent Type of ID,Type of ID
certificate.receipt.amount,Amount paid for certificate label,Amount paid:
certificate.receipt.amountDue,The label for due amount,Fee
certificate.receipt.birthService.after,Amount due on certificate for birth label,Birth registration after {target} days of date of birth
certificate.receipt.birthService.before,Amount due on certificate for birth label before target days,Birth registration before {target} days of date of birth
certificate.receipt.birthService.between,Amount due on certificate for birth label,Birth registration between {target} days and {latetarget} days of date of birth
certificate.receipt.deathService.after,Amount due on certificate for death label,Death registration after {target} days of date of death
certificate.receipt.deathService.before,Amount due on certificate for death label before target days,Death registration before {target} days of date of death
certificate.receipt.header,Receipt header for payment on certificate,Receipt for {event} Certificate of
certificate.receipt.issuedAt,Receipt on payment on certificate issued at label,Issued at:
certificate.receipt.issuedBy,,By:
certificate.receipt.issuedDate,,Date of payment:
certificate.receipt.issuer,Issuer information for receipt of certificate payment label,"By: {role}, {name} Date of payment: {dateOfPayment}"
certificate.receipt.marriageService.after,Amount due on certificate for marriage label,Marriage registration after {target} days of date of marriage
certificate.receipt.marriageService.before,Amount due on certificate for marriage label before target days,Marriage registration before {target} days of date of marriage
certificate.receipt.service,Service received for receipt label,Service
certificate.receipt.service..5year.amount,,৳ 50.00
certificate.receipt.service.5year,,{event} registration after 5 years of event
certificate.receipt.service.targetDay,,{event} registration after 45 days of event
certificate.receipt.service.targetDay.amount,,৳ 25.00
certificate.receipt.subheader,Subheader for receipt on payment on certificate,{event} Registration after {DOBDiff} of {DOE}
changeEmail.validation.msg,Phone number validation message,Must be a valid email address
changePhone.validation.msg,Phone number validation message,Must be a valid 10 digit number that starts with 0
config.advanced.search,This is used for the advanced search,Advanced Search
config.advanced.search.instruction,This is used for the advanced search,Select the options to build an advanced search. A minimum of two search parameters is required.
config.application.birthTabTitle,The title for birth tab,Birth
config.application.birthTabTitleExport,The title for birth tab for VSExport,Births
config.application.deathTabTitle,The title for death tab,Death
config.application.deathTabTitleExport,The title for death tab for VSExport,Deaths
config.application.emptystate,Vital Statistics Export Empty State Text,The previous month's vital statistics data (based on vital event registrations occurring within that month) will become available for you to export as of the 1st of every month. Large CSV files cannot be opened in Excel and should therefore be opened in a statistical program such as {posit}.
config.application.export,Download Export CSV,Export
config.application.vitalStatistics,Vital Statistics Export,"Month-{month}-Uganda-{event, select, birth{birth} death{death} other{birth}}-event-statistics.csv {fileSize}"
config.application.vsExportDownloadFailed,Vital Statistics Export Empty State Text,Sorry! Something went wrong
config.application.vsexport,VS Export tab,Vital statistics
config.certTemplate,Label for certificate templates,Certificate Template
config.certificate.options,Show options,Options
config.emailAllUsers.modal.supportingCopy,Label for send email all users confirmation supporting copy,User will receive emails over the next 24 hours
config.emailAllUsers.modal.title,Label for send email all users confirmation title,Send email to all users?
config.emailAllUsers.subtitle,Subtitle for email all users,This email will be sent to all users you are active. Emails will be sent over the next 24 hours. Only one email can be sent per day
config.emailAllUsers.title,Title for email all users,Email all users
config.userRoles.language,Language name,"{language, select, en {English} other {{language}}}"
config.userRoles.roleUpdateInstruction,Instruction for adding/updating role in role management modal,Add the roles to be assigned the system role of {systemRole}
conflicts.modal.assign.description,Description for modal when assign,Please note you will have sole access to this record. Please make any updates promptly otherwise unassign the record.
conflicts.modal.assign.title,Title for modal when assign,Assign record?
conflicts.modal.assigned.description,Description for modal when record already assigned,{name} at {officeName} has sole editable access to this record
conflicts.modal.assigned.title,Title for modal when record already assigned,Assigned record
conflicts.modal.regUnassign.description,Description for modal when registrar wants to unassign an assigned user,{name} at {officeName} currently has sole editable access to this record. Unassigning this record will mean their current edits will be lost. Please confirm you wish to continue.
conflicts.modal.selfUnassign.description,Description for modal when user wants to unassign him/herself,Unassigning this record will mean that any current edits will be lost. Please confirm you wish to continue.
conflicts.modal.unassign.title,Title for modal when unassign record,Unassign record?
constants.PIN,PIN label,PIN
constants.address,Label for address,Address
constants.ageVerificationApiUser,The description for AGE_VERIFICATION_API_USER role,Age verification API service
constants.allEvents,Label for select option All events,All events
constants.allStatuses,Label for select option All statuses,All statuses
constants.apiUser,The description for API_USER role,API User
constants.application.title,Application title,Application
constants.applicationArchivedOn,,Application archived on
constants.applicationName,Declaration name of CRVS,OpenCRVS
constants.archived_declaration,Application has been archived,Archived
constants.assignRecord,A label for the Assign record -button,Assign record
constants.averageRateOfRegistrations,A label for Average rate of registrations,Avg. {amount}%
constants.birth,A label from the birth event,Birth
constants.births,A label from the births event,Births
constants.by,Label for By (the person who performed the action),By
constants.certificate.title,Certificate title,Certificate
constants.certificationPaymentTitle,Label for certification payment performance reports,"Payment collected for {event, select, birth{birth} death{death} other{birth}} certificates"
constants.certified,A label for certified,certified
constants.cha,The description for CHA type,CHA
constants.chairman,The description for CHAIRMAN type,Chairman
constants.collected,The status label for collected,Collected
constants.collectedBy,The collected by sec text,Collected by
constants.collectorDetails,Label for collector details,Collector Details
constants.comment,Label for rejection comment,Comment
constants.config,,Configuration
constants.countryName,Name of the OpenCRVS implementation country,Uganda
constants.customTimePeriod,Label for Custom time period,Custom time period
constants.dataEntryClerk,The description for DATA_ENTRY_CLERK type,Data entry clerk
constants.dateOfDeclaration,Date of declaration label,Date of declaration
constants.daughter,,Daughter
constants.death,A label from the death event,Death
constants.deaths,A label from the deaths event,Deaths
constants.declaration,A label for declaration,declaration
constants.declarationCollectedOn,Label for the workflow timestamp when the status is collected,Certificate collected on
constants.declarationFailedOn,Label for the workflow timestamp when the status is failed,Failed to send on
constants.declarationRegisteredOn,Label for the workflow timestamp when the status is registered,Registered on
constants.declarationRejectedOn,Label for the workflow timestamp when the status is rejected,Declaration rejected on
constants.declarationRequestedCorrectionOn,Label for the workflow timestamp when the status is requested correction,Declaration requested correction on
constants.declarationSentForExternalValidationOn,Label for the workflow timestamp when the status is waiting_validation,Declaration sent for external validation on
constants.declarationStarted,Label for table header column Declaration started,Started
constants.declarationStartedBy,Label for table header column Started by,Started by
constants.declarationStartedOn,Label for the workflow timestamp when the status is draft created,Started on
constants.declarationState,A label to describe when the declaration was actioned on,Declaration {action} on
constants.declarationSubmittedOn,Label for the workflow timestamp when the status is declaration,Declaration submitted on
constants.declarationUpdatedOn,Label for the workflow timestamp when the status is draft updated,Updated on
constants.declarationValidatedOn,Label for the workflow timestamp when the status is validated,Declaration reviewed on
constants.declarations,Declaration title,Declarations
constants.declarationsCount,A label for declarations count,Declarations ({totalItems})
constants.declrationArchivedOn,Label for the workflow timestamp when the status is archived,Application archived on
constants.districtRegistrar,The description for DISTRICT_REGISTRAR role,District Registrar
constants.dnrpc,The description for DNRPC type,DNRPC
constants.dob,Date of birth label,D.o.B.
constants.dod,Label for DoD in work queue list item,D.o.D.
constants.downloaded,Label for application download status Downloaded,Downloaded
constants.downloading,Label for declaration download status Downloading,Downloading...
constants.draft,A label for draft,Draft
constants.duplicateOf,table header for `duplicate of` in record audit,Duplicate of
constants.emailAddress,Email label,Email Address
constants.emailBody,Label for email body input,Message
constants.emailSubject,Label for email subject input,Subject
constants.entrepeneur,The description for ENTREPENEUR type,Entrepeneur
constants.estimatedNumberOfEvents,A label for Estimated number of events,"Estimated{lineBreak}no. of {eventType, select, birth {birth} death {death} other {birth}}s"
constants.estimatedNumberOfRegistartion,A label for estimated no. of registrations,Estimated no. of registrations
constants.estimatedTargetDaysRegistrationTitle,A label for estimated vs total registered in {registrationTargetDays} days,Estimated vs total registered in {registrationTargetDays} days
constants.event,Label for Event of event in work queue list item,Event
constants.eventDate,Label for event date in list item,Date of event
constants.eventType,Label for table header column Event type,Event
constants.export,Label used for export,Export
constants.extendedFamily,,Extended family
constants.failedToSend,Label for declaration status Failed,Failed to send
constants.father,,Father
constants.female,The duplicates text for female,Female
constants.femaleOver18,Label for femaleOver18,Female Over 18
constants.femaleUnder18,Label for femaleUnder18,Female Under 18
constants.fieldAgent,The description for FIELD_AGENT role,Field Agent
constants.form.title,Form Declaration title,Declaration forms
constants.from,Label for text From,From
constants.gender,Gender label,Gender
constants.healthDivision,The description for HEALTH_DIVISION type,Health Division
constants.healthcareWorker,The description for Healthcare Worker type,Healthcare Worker
constants.history,History heading,History
constants.id,ID Label,ID
constants.idCheckWithoutVerify,Issuance without the confirmation of proof,Continue without proof of ID?
constants.inReview.status,A label for In Review,In review
constants.incomplete.status,A label for Incomplete,Incomplete
constants.informant,Informant Label,Notifier
constants.informantContactNumber,The title of contact number label,Notifier contact number
constants.integrations,Integration title,Integrations
constants.issueCertificate,Label for issue certificate,Issue Certificate
constants.issueConfirmationMessage,Confirmation of issuance,Please confirm that the certificate has been issued to the informant or collector.
constants.issueToBride,Issuing to bride,Issue to bride
constants.issueToFather,Issuing to father,Issue to father
constants.issueToGroom,Issuing to groom,Issue to groom
constants.issueToInformant,Issuance of death to informant,"Issue to informant ({informant, select, MOTHER {Mother} FATHER {Father} GRANDFATHER {Grandfather} GRANDMOTHER {Grandmother} BROTHER {Brother} SISTER {Sister} LEGAL_GUARDIAN {Legal guardian} BRIDE {Bride} GROOM {Groom} HEAD_OF_GROOM_FAMILY {Head of groom's family} HEAD_OF_BRIDE_FAMILY {Head of bride's family} SPOUSE {Spouse} SON {Son} DAUGHTER {Daughter} SON_IN_LAW {Son in law} DAUGHTER_IN_LAW {Daughter in law} GRANDSON {Grandson} GRANDDAUGHTER {Granddaughter} other {{informant}}})"
constants.issueToMother,Issuing to mother,Issue to mother
constants.issueToSomeoneElse,Issuing to someone else,Issue to someone else
constants.issuedBy,The issued by sec text,Issued by
constants.label.action,Action Label,Action
constants.label.date,Date Label,Date
constants.language,language label,Language
constants.last12Months,Label for preset date range Last 12 months,Last 12 months
constants.last30Days,Label for  preset date range Last 30 days,Last 30 days
constants.lastEdited,Label for rejection date in work queue list item,Last edited
constants.lastUpdated,Label for Last updated in list item,Last update
constants.loadMore,A label for load more,Load more
constants.localLeader,The description for Local Leader type,Local Leader
constants.localRegistrar,The description for LOCAL_REGISTRAR role,Registrar
constants.localSystemAdmin,,Local System Admin
constants.location,Label for location,Location
constants.login,,Login
constants.male,The duplicates text for male,Male
constants.maleOver18,Label for maleOver18,Male Over 18
constants.maleUnder18,Label for maleUnder18,Male Under 18
constants.marriage,A label from the marriage event,Marriage
constants.marriages,A label from the marriages event,Marriages
constants.matchedTo,table header for `Matched to` in record audit,Matched to
constants.mayor,The description for MAYOR type,Mayor
constants.month,Label for month,Month
constants.mother,,Mother
constants.name,Name label,Name
constants.nationalRegistrar,The description for NATIONAL_REGISTRAR role,National Registrar
constants.nationalSystemAdmin,The description for System admin (national),National System Admin
constants.noConnection,No Connection hover text,No connection
constants.noNameProvided,Label for empty title,No name provided
constants.noResults,Text to display if the search return no results for the current filters,No result
constants.noResultsOutbox,Text to display if there is no items in outbox,No records require processing
constants.notificationApiUser,The description for NOTIFICATION_API_USER role,Notification API role
constants.notificationSent,label for notification sent,Notification sent
constants.orgDivision,The description for ORG_DIVISION type,ORG Division
constants.over5Years,Label for registrations over 5 years,Over 5 years
constants.password,Password label,Password
constants.pendingConnection,Label for declaration status Pending Connection,Pending connection
constants.percentageOfEstimation,A label for percentage of estimate,Percentage of estimate
constants.performance,Performance title,Performance
constants.performanceManagement,The description for Performance Management role,Performance Manager
constants.phoneNumber,Phone label,Phone number
constants.policeOfficer,The description for Police Officer type,Police Officer
constants.rateOfRegistrationWithinTargetd,,Rate within {registrationTargetDays}{lineBreak}days of event
constants.rateOfRegistrationWithinYears,,"Rate within {num} {num, plural, =0 {year} =1 {year} other {years}} of event"
constants.reason,Label for Reason the declaration was rejected,Reason
constants.record,Label for header table header Record,Record
constants.refresh,label for refresh,refresh
constants.registered,A label for registered,Registered
